{
  "schema_version": "2.0",
  "conflitti": [],
  "debolezza": "i18n:traits.antenne_flusso_mareale.debolezza",
  "famiglia_tipologia": "Offensivo/Assalto",
  "fattore_mantenimento_energetico": "Basso (Passivo)",
  "id": "antenne_flusso_mareale",
  "label": "i18n:traits.antenne_flusso_mareale.label",
  "mutazione_indotta": "i18n:traits.antenne_flusso_mareale.mutazione_indotta",
  "requisiti_ambientali": [
    {
      "capacita_richieste": [],
      "condizioni": {
        "biome_class": "laguna_bioreattiva"
      },
      "fonte": "env_to_traits",
      "meta": {
        "expansion": "coverage_q4_2025",
        "notes": "Antenne Flusso Mareale ottimizza le operazioni offensivo nelle condizioni di laguna bioreattiva.",
        "tier": "T1"
      }
    }
  ],
  "sinergie": [
    "coda_frusta_cinetica",
    "sangue_piroforico"
  ],
  "sinergie_pi": {
    "co_occorrenze": [],
    "combo_totale": 2,
    "forme": [],
    "tabelle_random": []
  },
  "slot": [],
  "slot_profile": {
    "complementare": "assalto",
    "core": "offensivo"
  },
  "spinta_selettiva": "i18n:traits.antenne_flusso_mareale.spinta_selettiva",
  "tier": "T1",
  "uso_funzione": "i18n:traits.antenne_flusso_mareale.uso_funzione",
  "usage_tags": [
    "breaker"
  ],
  "completion_flags": {
    "has_biome": true,
    "has_species_link": false,
    "has_usage_tags": true,
    "has_data_origin": true
  },
  "biome_tags": [
    "laguna_bioreattiva"
  ],
  "data_origin": "coverage_q4_2025"
}
