{
  "schema_version": "2.0",
  "id": "occhi_cristallo_modulare",
  "label": "i18n:traits.occhi_cristallo_modulare.label",
  "famiglia_tipologia": "Sensoriale/Visivo",
  "fattore_mantenimento_energetico": "Moderato (Attivo)",
  "tier": "T2",
  "slot": [
    "A",
    "B"
  ],
  "sinergie": [
    "occhi_cinetici",
    "visione_multi_spettrale_amplificata",
    "echi_risonanti",
    "coda_balanciere",
    "midollo_antivibrazione"
  ],
  "sinergie_pi": {
    "co_occorrenze": [
      "sigillo_forma",
      "starter_bioma"
    ],
    "combo_totale": 3,
    "forme": [
      "INTP",
      "ISTP",
      "ISTJ"
    ],
    "tabelle_random": []
  },
  "conflitti": [],
  "data_origin": "pathfinder_dataset",
  "mutazione_indotta": "i18n:traits.occhi_cristallo_modulare.mutazione_indotta",
  "uso_funzione": "i18n:traits.occhi_cristallo_modulare.uso_funzione",
  "spinta_selettiva": "i18n:traits.occhi_cristallo_modulare.spinta_selettiva",
  "completion_flags": {
    "has_biome": false,
    "has_species_link": true,
    "has_data_origin": true
  },
  "slot_profile": {
    "core": "sensoriale",
    "complementare": "visivo"
  },
  "usage_tags": [
    "scout"
  ],
  "species_affinity": [
    {
      "roles": [
        "core"
      ],
      "species_id": "orbital-ascendant",
      "weight": 3
    },
    {
      "roles": [
        "optional"
      ],
      "species_id": "psionic-canopy-scout",
      "weight": 2
    }
  ],
  "debolezza": "i18n:traits.occhi_cristallo_modulare.debolezza"
}
