{
  "schema_version": "2.0",
  "conflitti": [],
  "debolezza": "i18n:traits.branchie_solfatiche.debolezza",
  "famiglia_tipologia": "Digestivo/Metabolico",
  "fattore_mantenimento_energetico": "Basso (Passivo)",
  "id": "branchie_solfatiche",
  "label": "i18n:traits.branchie_solfatiche.label",
  "mutazione_indotta": "i18n:traits.branchie_solfatiche.mutazione_indotta",
  "requisiti_ambientali": [
    {
      "capacita_richieste": [],
      "condizioni": {
        "biome_class": "caldera_glaciale"
      },
      "fonte": "env_to_traits",
      "meta": {
        "expansion": "coverage_q4_2025",
        "notes": "Branchie Solfatiche ottimizza le operazioni metabolico nelle condizioni di caldera glaciale.",
        "tier": "T1"
      }
    }
  ],
  "sinergie": [
    "filamenti_digestivi_compattanti",
    "ventriglio_gastroliti"
  ],
  "sinergie_pi": {
    "co_occorrenze": [],
    "combo_totale": 2,
    "forme": [],
    "tabelle_random": []
  },
  "slot": [],
  "slot_profile": {
    "complementare": "energia",
    "core": "metabolico"
  },
  "spinta_selettiva": "i18n:traits.branchie_solfatiche.spinta_selettiva",
  "tier": "T1",
  "uso_funzione": "i18n:traits.branchie_solfatiche.uso_funzione",
  "usage_tags": [
    "sustain"
  ],
  "completion_flags": {
    "has_biome": true,
    "has_species_link": false,
    "has_usage_tags": true,
    "has_data_origin": true
  },
  "biome_tags": [
    "caldera_glaciale"
  ],
  "data_origin": "coverage_q4_2025"
}
