{
  "schema_version": "2.0",
  "id": "articolazioni_multiassiali",
  "label": "i18n:traits.articolazioni_multiassiali.label",
  "data_origin": "coverage_q4_2025",
  "famiglia_tipologia": "Locomotivo/Terrestre",
  "fattore_mantenimento_energetico": "Medio (manutenzione periodica o situazionale)",
  "tier": "T3",
  "slot": [],
  "sinergie": [
    "coda_prensile_muscolare"
  ],
  "conflitti": [],
  "mutazione_indotta": "i18n:traits.articolazioni_multiassiali.mutazione_indotta",
  "uso_funzione": "i18n:traits.articolazioni_multiassiali.uso_funzione",
  "spinta_selettiva": "i18n:traits.articolazioni_multiassiali.spinta_selettiva",
  "metrics": [
    {
      "name": "accelerazione_0_10",
      "value": 4.2,
      "unit": "m/s2"
    }
  ],
  "cost_profile": {
    "rest": "Basso",
    "burst": "Medio",
    "sustained": "Basso"
  },
  "testability": {
    "observable": "Pivot a 180° in corridoio 1 m",
    "scene_prompt": "Traccia cono di sterzata su terreno bagnato"
  },
  "requisiti_ambientali": [
    {
      "capacita_richieste": [],
      "condizioni": {
        "biome_class": "terrestre"
      },
      "fonte": "envo_mapping",
      "meta": {
        "tier": "T3",
        "notes": "Necessitano di terreno solido terrestre per distribuire il peso su più assi senza cedere."
      }
    }
  ],
  "applicability": {
    "clades": [],
    "envo_terms": [
      "http://purl.obolibrary.org/obo/ENVO_01000228"
    ]
  },
  "usage_tags": [
    "scout"
  ],
  "slot_profile": {
    "core": "locomotivo",
    "complementare": "terrestre"
  },
  "species_affinity": [],
  "version": "1.0.0",
  "versioning": {
    "created": "2025-11-04",
    "updated": "2025-11-23",
    "author": "Master DD / GPT-5 Pro"
  },
  "debolezza": "i18n:traits.articolazioni_multiassiali.debolezza"
}
