{
  "schema_version": "2.0",
  "conflitti": [],
  "debolezza": "i18n:traits.artigli_radice.debolezza",
  "famiglia_tipologia": "Strategico/Tattico",
  "fattore_mantenimento_energetico": "Basso (Passivo)",
  "id": "artigli_radice",
  "label": "i18n:traits.artigli_radice.label",
  "mutazione_indotta": "i18n:traits.artigli_radice.mutazione_indotta",
  "requisiti_ambientali": [
    {
      "capacita_richieste": [],
      "condizioni": {
        "biome_class": "mangrovieto_cinetico"
      },
      "fonte": "env_to_traits",
      "meta": {
        "expansion": "coverage_q4_2025",
        "notes": "Artigli Radice ottimizza le operazioni strategia nelle condizioni di mangrovieto cinetico.",
        "tier": "T1"
      }
    }
  ],
  "sinergie": [
    "pianificatore",
    "tattiche_di_branco"
  ],
  "sinergie_pi": {
    "co_occorrenze": [],
    "combo_totale": 2,
    "forme": [],
    "tabelle_random": []
  },
  "slot": [],
  "slot_profile": {
    "complementare": "tattico",
    "core": "strategia"
  },
  "spinta_selettiva": "i18n:traits.artigli_radice.spinta_selettiva",
  "tier": "T1",
  "uso_funzione": "i18n:traits.artigli_radice.uso_funzione",
  "usage_tags": [
    "support"
  ],
  "completion_flags": {
    "has_biome": true,
    "has_species_link": false,
    "has_usage_tags": true,
    "has_data_origin": true
  },
  "biome_tags": [
    "mangrovieto_cinetico"
  ],
  "data_origin": "coverage_q4_2025"
}
