{
  "id": "startle_reflex",
  "label": "i18n:traits.startle_reflex.label",
  "famiglia_tipologia": "TODO/import_esterno",
  "fattore_mantenimento_energetico": "i18n:traits.startle_reflex.fattore_mantenimento_energetico",
  "tier": "T1",
  "slot": [],
  "slot_profile": {
    "core": "da_definire",
    "complementare": "da_definire"
  },
  "sinergie": [],
  "conflitti": [],
  "mutazione_indotta": "i18n:traits.startle_reflex.mutazione_indotta",
  "uso_funzione": "i18n:traits.startle_reflex.uso_funzione",
  "spinta_selettiva": "i18n:traits.startle_reflex.spinta_selettiva",
  "completion_flags": {
    "external_source": true
  },
  "data_origin": "incoming_sensienti_traits_v0_1_t1_protosentiente"
}
