{
  "schema_version": "2.0",
  "id": "mente_lucida",
  "label": "i18n:traits.mente_lucida.label",
  "famiglia_tipologia": "Mentale/Cognizione",
  "fattore_mantenimento_energetico": "Medio (situazionale)",
  "tier": "T2",
  "slot_profile": {
    "core": "cognitivo",
    "complementare": "cognizione"
  },
  "slot": [],
  "sinergie": [
    "artigli_psionici",
    "cervello_predittivo"
  ],
  "conflitti": [],
  "mutazione_indotta": "i18n:traits.mente_lucida.mutazione_indotta",
  "uso_funzione": "i18n:traits.mente_lucida.uso_funzione",
  "spinta_selettiva": "i18n:traits.mente_lucida.spinta_selettiva",
  "data_origin": "gap1_salvage_2026_06_22",
  "completion_flags": {
    "design_stub": false
  },
  "debolezza": "i18n:traits.mente_lucida.debolezza"
}
