{
  "schema_version": "2.0",
  "conflitti": [
    "mimetismo_cromatico_passivo"
  ],
  "debolezza": "i18n:traits.squame_rifrangenti_deserto.debolezza",
  "famiglia_tipologia": "Tegumentario/Difensivo",
  "fattore_mantenimento_energetico": "Medio (Richiede riallineamento delle placche)",
  "id": "squame_rifrangenti_deserto",
  "label": "i18n:traits.squame_rifrangenti_deserto.label",
  "mutazione_indotta": "i18n:traits.squame_rifrangenti_deserto.mutazione_indotta",
  "requisiti_ambientali": [
    {
      "capacita_richieste": [],
      "condizioni": {
        "biome_class": "dune_cristalline"
      },
      "fonte": "env_to_traits",
      "meta": {
        "expansion": "controllo_psionico",
        "notes": "Deserti di quarzo e vetro dove le tempeste solari vengono amplificate.",
        "tier": "T2"
      }
    }
  ],
  "sinergie": [
    "respiro_a_scoppio"
  ],
  "sinergie_pi": {
    "co_occorrenze": [],
    "combo_totale": 0,
    "forme": [],
    "tabelle_random": []
  },
  "slot": [],
  "slot_profile": {
    "complementare": "difensivo",
    "core": "tegumentario"
  },
  "spinta_selettiva": "i18n:traits.squame_rifrangenti_deserto.spinta_selettiva",
  "tier": "T2",
  "uso_funzione": "i18n:traits.squame_rifrangenti_deserto.uso_funzione",
  "usage_tags": [
    "tank"
  ],
  "completion_flags": {
    "has_biome": true,
    "has_species_link": false,
    "has_usage_tags": true,
    "has_data_origin": true
  },
  "biome_tags": [
    "dune_cristalline"
  ],
  "data_origin": "controllo_psionico"
}
